{
  "schema_version": "sts2-state-transition/1",
  "transition_id": {
    "namespace": "sts2.transition",
    "value": "synthetic-transition-1"
  },
  "identities": {
    "instance_id": {
      "namespace": "sts2.instance",
      "value": "synthetic-instance-1"
    },
    "session_id": {
      "namespace": "sts2.session",
      "value": "synthetic-session-1"
    },
    "run_id": {
      "namespace": "sts2.run",
      "value": "synthetic-run-1"
    },
    "episode_id": {
      "namespace": "sts2.episode",
      "value": "synthetic-episode-1"
    },
    "trajectory_id": {
      "namespace": "sts2.trajectory",
      "value": "synthetic-trajectory-1"
    },
    "trace_id": {
      "namespace": "sts2.trace",
      "value": "synthetic-trace-1"
    }
  },
  "operation_id": {
    "namespace": "sts2.operation",
    "value": "synthetic-operation-1"
  },
  "build_profile": {
    "build_id": "synthetic-build-1",
    "semantic_version": null,
    "channel": "offline",
    "platform": null,
    "architecture": null,
    "profile_id": "synthetic-profile-1",
    "profile_digest": {
      "algorithm": "sha256",
      "value": "0000000000000000000000000000000000000000000000000000000000000000"
    },
    "locale": null,
    "resolution": {
      "width": null,
      "height": null
    },
    "ui_scale": null,
    "input_method": "semantic",
    "active_mods": [],
    "run_modifiers": []
  },
  "source_state": {
    "namespace": "sts2.state",
    "value": "awaiting_player_action"
  },
  "source_observation": {
    "observation_id": {
      "namespace": "sts2.observation",
      "value": "synthetic-observation-1"
    },
    "generation": 1,
    "freshness": "fresh"
  },
  "action": {
    "action_id": {
      "namespace": "sts2.action",
      "value": "synthetic-action-1"
    },
    "action_type": "SYS.REOBSERVE",
    "target_domain": {
      "type": "none",
      "allowed_ids": [],
      "selection": "none"
    }
  },
  "expected_successor_states": [
    {
      "namespace": "sts2.state",
      "value": "awaiting_player_action"
    }
  ],
  "settlement": {
    "status": "unknown",
    "dispatch_count": 1,
    "reconciliation_required": true,
    "reason": "timeout"
  },
  "actual_target_state": null,
  "target_observation": null,
  "timing": {
    "recorded_at": "2026-09-04T00:00:00Z",
    "latency_ms": null,
    "deadline_ms": 100
  },
  "success_evidence": [],
  "failure_evidence": [
    {
      "code": "none",
      "generation": 1,
      "evidence_status": "proposed"
    }
  ],
  "recovery": {
    "mode": "reconcile",
    "required": true,
    "attempts": 0,
    "reason": "possible_mutation"
  },
  "uncertainty": {
    "status": "unknown",
    "confidence": 0,
    "source": "unknown"
  },
  "provenance": {
    "source_kind": "synthetic",
    "evidence_status": "proposed",
    "epistemic_status": "hypothesized",
    "source_ids": [
      "schema-regression-20260904"
    ],
    "captured_at": "2026-09-04T00:00:00Z",
    "confidence": 0,
    "independent_verification": false,
    "policy_visible": true
  }
}
